{
  "budget_ledger": {
    "budget_cny": 20000,
    "currency": "CNY",
    "items": [
      {
        "amount_max_cny": null,
        "amount_min_cny": null,
        "basis": "standalone Trip budget ledger",
        "category": "trip",
        "included_in_total": true,
        "price_type": null,
        "reason": "Trip ledger contains an incomparable price bound",
        "ref_id": "trip-c5eba1b26542ed43"
      },
      {
        "amount_max_cny": null,
        "amount_min_cny": null,
        "basis": "standalone Trip budget ledger",
        "category": "trip",
        "included_in_total": true,
        "price_type": null,
        "reason": "Trip ledger contains an incomparable price bound",
        "ref_id": "trip-340ff80bd26a58fd"
      },
      {
        "amount_max_cny": null,
        "amount_min_cny": null,
        "basis": "standalone Trip budget ledger",
        "category": "trip",
        "included_in_total": true,
        "price_type": null,
        "reason": "Trip ledger contains an incomparable price bound",
        "ref_id": "trip-9a8586b503e3f574"
      },
      {
        "amount_max_cny": 0,
        "amount_min_cny": 0,
        "basis": "additional cross-segment transport",
        "category": "cross_segment_transport",
        "included_in_total": true,
        "price_type": "unknown",
        "reason": "cross-segment transport is already included in trip-340ff80bd26a58fd",
        "ref_id": "connection-ca34a4c8226b59cd"
      },
      {
        "amount_max_cny": 0,
        "amount_min_cny": 0,
        "basis": "additional cross-segment transport",
        "category": "cross_segment_transport",
        "included_in_total": true,
        "price_type": "unknown",
        "reason": "cross-segment transport is already included in trip-9a8586b503e3f574",
        "ref_id": "connection-ef686f4e7b229a10"
      }
    ],
    "known_cost_cny": 4200,
    "remaining_known_budget_cny": 15800,
    "status": "incomplete",
    "total_range_cny": {
      "maximum": null,
      "minimum": null
    }
  },
  "end_date": "2026-10-16",
  "generated_at": "2026-09-05T09:00:00+08:00",
  "journey_id": "journey-d7d147568550c48c",
  "origin": {
    "city": "北京",
    "name": "北京",
    "ref_id": "city-beijing"
  },
  "revision": {
    "created_at": "2026-09-05T09:00:00+08:00",
    "created_by": "system",
    "number": 1,
    "parent_revision": null,
    "reason": "initial multi-Trip journey plan"
  },
  "schema_version": "1.0.0",
  "segment_connections": [
    {
      "connection_id": "connection-ca34a4c8226b59cd",
      "cross_segment_transport": {
        "amount_max_cny": null,
        "amount_min_cny": null,
        "included_in_trip_id": "trip-340ff80bd26a58fd",
        "leg_id": "leg-rail-fallback-03178f234e57",
        "price_type": "unknown",
        "reason": "price amount is not verified and cannot be compared with the trip budget",
        "status": "included_in_next_trip"
      },
      "from_end_date": "2026-10-05",
      "from_trip_id": "trip-c5eba1b26542ed43",
      "lodging_continuity": {
        "from_lodging_id": "lodging-j16-shanghai-central",
        "overnight_date": "2026-10-05",
        "reason": "the preceding lodging covers the boundary night before the next stay begins",
        "status": "changed",
        "to_lodging_id": "lodging-j16-hangzhou-central"
      },
      "to_start_date": "2026-10-06",
      "to_trip_id": "trip-340ff80bd26a58fd"
    },
    {
      "connection_id": "connection-ef686f4e7b229a10",
      "cross_segment_transport": {
        "amount_max_cny": null,
        "amount_min_cny": null,
        "included_in_trip_id": "trip-9a8586b503e3f574",
        "leg_id": "leg-rail-fallback-b66b4e0b7f99",
        "price_type": "unknown",
        "reason": "price amount is not verified and cannot be compared with the trip budget",
        "status": "included_in_next_trip"
      },
      "from_end_date": "2026-10-10",
      "from_trip_id": "trip-340ff80bd26a58fd",
      "lodging_continuity": {
        "from_lodging_id": "lodging-j16-hangzhou-central",
        "overnight_date": "2026-10-10",
        "reason": "the preceding lodging covers the boundary night before the next stay begins",
        "status": "changed",
        "to_lodging_id": "lodging-j16-suzhou-central"
      },
      "to_start_date": "2026-10-11",
      "to_trip_id": "trip-9a8586b503e3f574"
    }
  ],
  "segmentation": {
    "actual_segment_days": [
      5,
      5,
      6
    ],
    "assumptions": [
      "JOURNEY_SEGMENTATION expected_days=none actual_days=5,5,6; Trip count is minimized under maximum_days=7 and cuts prefer lodging-city changes"
    ],
    "expected_segment_days": null,
    "maximum_segment_days": 7,
    "strategy": "minimum_segments"
  },
  "start_date": "2026-10-01",
  "travelers": 2,
  "trips": [
    {
      "budget_ledger": {
        "budget_cny": 20000,
        "currency": "CNY",
        "items": [
          {
            "amount_max_cny": null,
            "amount_min_cny": null,
            "basis": "unknown/per_person",
            "category": "transport",
            "included_in_scheduler": false,
            "price_type": "unknown",
            "reason": "price amount is not verified and cannot be compared with the trip budget",
            "ref_id": "leg-rail-fallback-5945359c4de0"
          },
          {
            "amount_max_cny": 1500,
            "amount_min_cny": 1500,
            "basis": "300 per night × 5 nights × 1 rooms",
            "category": "lodging",
            "included_in_scheduler": true,
            "price_type": "reference",
            "reason": null,
            "ref_id": "lodging-j16-shanghai-central"
          },
          {
            "amount_max_cny": null,
            "amount_min_cny": null,
            "basis": "price unavailable",
            "category": "poi",
            "included_in_scheduler": false,
            "price_type": null,
            "reason": "no comparable price was supplied",
            "ref_id": "poi-j16-shanghai"
          },
          {
            "amount_max_cny": null,
            "amount_min_cny": null,
            "basis": "price unavailable",
            "category": "poi",
            "included_in_scheduler": false,
            "price_type": null,
            "reason": "no comparable price was supplied",
            "ref_id": "poi-routine-meal-0e4270b5bf83"
          },
          {
            "amount_max_cny": null,
            "amount_min_cny": null,
            "basis": "price unavailable",
            "category": "poi",
            "included_in_scheduler": false,
            "price_type": null,
            "reason": "no comparable price was supplied",
            "ref_id": "poi-routine-meal-73427587e6c2"
          },
          {
            "amount_max_cny": null,
            "amount_min_cny": null,
            "basis": "price unavailable",
            "category": "poi",
            "included_in_scheduler": false,
            "price_type": null,
            "reason": "no comparable price was supplied",
            "ref_id": "poi-routine-meal-1e0ad4479333"
          },
          {
            "amount_max_cny": null,
            "amount_min_cny": null,
            "basis": "price unavailable",
            "category": "poi",
            "included_in_scheduler": false,
            "price_type": null,
            "reason": "no comparable price was supplied",
            "ref_id": "poi-routine-meal-dd82101e004d"
          },
          {
            "amount_max_cny": null,
            "amount_min_cny": null,
            "basis": "price unavailable",
            "category": "poi",
            "included_in_scheduler": false,
            "price_type": null,
            "reason": "no comparable price was supplied",
            "ref_id": "poi-routine-meal-6fe6c1ec3822"
          },
          {
            "amount_max_cny": null,
            "amount_min_cny": null,
            "basis": "price unavailable",
            "category": "poi",
            "included_in_scheduler": false,
            "price_type": null,
            "reason": "no comparable price was supplied",
            "ref_id": "poi-routine-meal-2acb635f18d4"
          },
          {
            "amount_max_cny": null,
            "amount_min_cny": null,
            "basis": "price unavailable",
            "category": "poi",
            "included_in_scheduler": false,
            "price_type": null,
            "reason": "no comparable price was supplied",
            "ref_id": "poi-routine-meal-54035b633e42"
          },
          {
            "amount_max_cny": null,
            "amount_min_cny": null,
            "basis": "price unavailable",
            "category": "poi",
            "included_in_scheduler": false,
            "price_type": null,
            "reason": "no comparable price was supplied",
            "ref_id": "poi-routine-meal-7a2c2df8121e"
          },
          {
            "amount_max_cny": null,
            "amount_min_cny": null,
            "basis": "price unavailable",
            "category": "poi",
            "included_in_scheduler": false,
            "price_type": null,
            "reason": "no comparable price was supplied",
            "ref_id": "poi-routine-meal-7d78c44eb96e"
          },
          {
            "amount_max_cny": null,
            "amount_min_cny": null,
            "basis": "price unavailable",
            "category": "poi",
            "included_in_scheduler": false,
            "price_type": null,
            "reason": "no comparable price was supplied",
            "ref_id": "poi-routine-meal-1b6979118ddd"
          }
        ],
        "known_cost_cny": 1500,
        "remaining_known_budget_cny": 18500,
        "status": "incomplete",
        "total_range_cny": {
          "maximum": null,
          "minimum": null
        }
      },
      "claims": [
        {
          "as_of": null,
          "claim_id": "claim-j16-shanghai-lodging-price",
          "confidence": 0.8,
          "field_path": "/price",